{
  "contract": "ai_daily_worker",
  "protocol_version": 1,
  "request_id": "34444444-3444-4444-8444-344444444444",
  "file_path": "C:\\scanner-fixtures\\工作 目录\\legacy-export.doc",
  "file_type": ".doc",
  "backend": "python_sharepoint_text_v1",
  "remaining_timeout_ms": 30000,
  "max_file_size_bytes": 52428800,
  "parser_limits": {
    "kind": "sharepoint_text",
    "excerpt_max_chars": 6000
  },
  "expected_source_version": "mtime_ns=4000000000:size=1024"
}
