{
  "contract": "ai_daily_worker",
  "protocol_version": 1,
  "request_id": "31111111-3111-4111-8111-311111111111",
  "file_path": "C:\\scanner-fixtures\\工作 目录\\sample.docx",
  "file_type": ".docx",
  "backend": "rust_office_oxide_v1",
  "remaining_timeout_ms": 30000,
  "max_file_size_bytes": 52428800,
  "parser_limits": {
    "kind": "office",
    "excel_max_sheets": 5,
    "excel_max_rows": 50,
    "excel_max_columns": 20,
    "docx_max_paragraphs": 200,
    "docx_max_tables": 20,
    "docx_table_max_rows": 50,
    "docx_table_max_cols": 12,
    "pptx_max_slides": 50,
    "pptx_include_notes": true,
    "document_excerpt_max_chars": 6000
  },
  "expected_source_version": "mtime_ns=1000000000:size=4096"
}
